{
  "$schema": "http://json-schema.org/draft-07/schema#",
  "$id": "https://github.com/Kappaemme-git/codex-first-customer-finder-skill/first-customer-finder/references/report.schema.json",
  "title": "First Customer Finder report",
  "description": "JSON contract for the analysis file consumed by scripts/generate_report.py. Derived from references/report-artifact.md and references/research-framework.md.",
  "type": "object",
  "additionalProperties": false,
  "required": ["title", "product", "product_url", "target_customer", "generated_at", "verdict", "prospects"],
  "properties": {
    "title": {
      "type": "string",
      "description": "Report title shown in the hero."
    },
    "product": {
      "type": "string",
      "description": "Product or startup name."
    },
    "product_url": {
      "type": "string",
      "format": "uri",
      "description": "Public URL of the product or landing page."
    },
    "target_customer": {
      "type": "string",
      "description": "Primary ideal customer profile label."
    },
    "search_scope": {
      "type": "string",
      "description": "Time, language, and source scope used for research."
    },
    "generated_at": {
      "type": "string",
      "format": "date",
      "description": "Date the report was generated (YYYY-MM-DD)."
    },
    "verdict": {
      "type": "string",
      "description": "One-sentence read on whether reachable early-customer signals exist."
    },
    "prospects": {
      "type": "array",
      "description": "Qualified prospects. Normal mode: up to ten. Every primary prospect must include a valid public source URL and a score from 0 to 100.",
      "items": { "$ref": "#/definitions/prospect" }
    },
    "patterns": {
      "type": "array",
      "description": "Repeated pain or trigger patterns observed across prospects.",
      "items": { "$ref": "#/definitions/pattern" }
    },
    "outreach_plan": { "$ref": "#/definitions/outreachPlan" },
    "limits": {
      "type": "array",
      "description": "Caveats shown in the responsible-use section.",
      "items": { "type": "string" }
    }
  },
  "definitions": {
    "prospect": {
      "type": "object",
      "additionalProperties": false,
      "required": ["name", "type", "stage", "score", "pain_signal", "why_fit", "why_now", "source_url", "dimensions"],
      "properties": {
        "name": {
          "type": "string",
          "description": "Displayed company, project, or public professional name."
        },
        "type": {
          "type": "string",
          "description": "Prospect category, e.g. Company, Person, Project."
        },
        "stage": {
          "type": "string",
          "enum": ["High intent", "Problem aware", "Trigger present", "Potential fit"],
          "description": "Qualification stage from the research framework."
        },
        "score": {
          "type": "integer",
          "minimum": 0,
          "maximum": 100,
          "description": "Composite fit score from 0 to 100, computed from the five weighted dimensions."
        },
        "pain_signal": {
          "type": "string",
          "description": "Concise public pain, demand, or timing signal."
        },
        "evidence": {
          "type": "string",
          "description": "What the public source shows."
        },
        "why_fit": {
          "type": "string",
          "description": "Why the product fits the evidenced job."
        },
        "why_now": {
          "type": "string",
          "description": "Why this is relevant now, including freshness and any current trigger."
        },
        "source_title": {
          "type": "string",
          "description": "Title of the public source."
        },
        "source_url": {
          "type": "string",
          "format": "uri",
          "description": "Public URL of the original source."
        },
        "source_type": {
          "type": "string",
          "description": "Source category, e.g. Public forum, Review, GitHub issue, Company page."
        },
        "signal_date": {
          "type": "string",
          "format": "date",
          "description": "Visible publication date of the signal (YYYY-MM-DD)."
        },
        "suggested_channel": {
          "type": "string",
          "description": "Natural, relevant public or professional contact path."
        },
        "opener": {
          "type": "string",
          "description": "Source-based outreach opener, under 90 words by default."
        },
        "caution": {
          "type": "string",
          "description": "What must be confirmed before outreach."
        },
        "dimensions": { "$ref": "#/definitions/dimensions" }
      }
    },
    "dimensions": {
      "type": "object",
      "additionalProperties": false,
      "required": ["pain_strength", "product_fit", "timing", "reachability", "evidence_quality"],
      "description": "Per-dimension scores from 0 to 5. Composite score = pain/5*25 + fit/5*25 + timing/5*20 + reachability/5*15 + evidence/5*15.",
      "properties": {
        "pain_strength": { "type": "integer", "minimum": 0, "maximum": 5 },
        "product_fit": { "type": "integer", "minimum": 0, "maximum": 5 },
        "timing": { "type": "integer", "minimum": 0, "maximum": 5 },
        "reachability": { "type": "integer", "minimum": 0, "maximum": 5 },
        "evidence_quality": { "type": "integer", "minimum": 0, "maximum": 5 }
      }
    },
    "pattern": {
      "type": "object",
      "additionalProperties": false,
      "required": ["title", "count", "insight"],
      "properties": {
        "title": { "type": "string" },
        "count": { "type": "integer", "minimum": 0 },
        "insight": { "type": "string" }
      }
    },
    "outreachPlan": {
      "type": "object",
      "additionalProperties": false,
      "required": ["angle", "first_step", "follow_up", "success"],
      "properties": {
        "angle": { "type": "string" },
        "first_step": { "type": "string" },
        "follow_up": { "type": "string" },
        "success": { "type": "string" }
      }
    }
  }
}
